{
  "schema_version": "sys4ai.plan-task-receipt.v3",
  "receipt_id": "RCP-REPLACE-ME",
  "run_id": "RUN-REPLACE-ME",
  "plan_id": "PLAN-REPLACE-ME",
  "plan_sha256": "0000000000000000000000000000000000000000000000000000000000000000",
  "generation": 1,
  "task_id": "TASK-REPLACE-ME",
  "task_sha256": "0000000000000000000000000000000000000000000000000000000000000000",
  "worker_thread_id": "WORKER-THREAD-REPLACE-ME",
  "result_sha256": "0000000000000000000000000000000000000000000000000000000000000000",
  "disposition": "completed",
  "evidence": {},
  "repository_fingerprint": "REPOSITORY-FINGERPRINT-REPLACE-ME",
  "control_fingerprint": "CONTROL-FINGERPRINT-REPLACE-ME",
  "relay_profile": "recursive_chain_v1",
  "relay_topology": "recursive_chain_v1",
  "invocation_count": 1,
  "successor_count": 0,
  "created_at": "2000-01-01T00:00:00Z"
}
